id,project,provider,tool,task_type,description,hours_estimate,value_usd,first_pass,corrections,output,notes,cost_model,cost_usd,session_id,created_at
2,cpm-agent,anthropic,cowork,code,Built universal AI tracker,2.5,375.0,True,0,,,per-token,0.97,,2026-07-03T07:14:22.363Z
4,cpm-agent,anthropic,cowork,research,Read REFERENCE.md and summarized CPM Agent architecture,1.0,125.0,True,0,Architecture summary,"Verified Vercel cron, Neon tables, Resend",per-token,0.09,cpm-session-01,2026-07-04T14:36:38.730Z
5,cpm-agent,anthropic,cowork,document,Created updated HTML project summary with Vercel/Neon/Resend architecture,2.0,160.0,True,0,CPM Agent System Project Summary.html,Clickable card-based layout,per-token,0.12,cpm-session-01,2026-07-04T14:36:39.145Z
6,cpm-agent,anthropic,cowork,analysis,Designed Guild ROI + HITL tracking system with 8 ROI dimensions and 6 agent modes,3.0,525.0,False,1,ROI framework design,1 correction: clarified Malloy role,per-token,0.18,cpm-session-01,2026-07-04T14:36:39.400Z
7,cpm-agent,anthropic,cowork,code,"Rewrote agent.ts with full HITL tracking, 8 ROI metrics, 6 modes",5.0,750.0,True,0,agent/agent.ts (578 lines),Full rewrite with ChangeRequest type,per-token,0.28,cpm-session-01,2026-07-04T14:36:39.780Z
8,cpm-agent,anthropic,cowork,testing,Autonomous static analysis + state machine simulation of agent.ts,2.0,200.0,True,0,Test results: all logic verified,Caught JSDoc index false-positive,per-token,0.1,cpm-session-01,2026-07-04T14:36:40.043Z
9,cpm-agent,anthropic,cowork,document,Created ROI and HITL Guide HTML document (6 sections),2.5,200.0,True,0,CPM Agent ROI and HITL Guide.html,"Covers both HITL types, all 6 agent modes",per-token,0.11,cpm-session-01,2026-07-04T14:36:40.299Z
10,cpm-agent,anthropic,cowork,code,"Designed and built universal-tracker.ts Guild agent (7-task backfill, 6 modes)",4.0,600.0,True,0,agent/universal-tracker.ts,"23.5h, $2882.50 value, 83% first-pass rate",per-token,0.09,cpm-session-01,2026-07-04T14:36:40.568Z
